### ISSUE TITLE
After vLLM starts and establishes a connection with LMCache, LMCache actively disconnects the connection after 30 seconds.

### ISSUE THREAD

**Issue by Robot1024** [LMCache/LMCache#4213]
**LMCache v0.5.1 (g979719d7)**
**vLLM version 0.17.1**
**CUDA Version: 13.2**

**LMCache  start**

lmcache server \
    --l1-size-gb 10 \
    --eviction-policy LRU \
    --host 0.0.0.0 \
    --port 8000 \
    --chunk-size 256 \
    --max-workers 8 \
    --l2-adapter '{"type":"fs","base_path":"/mnt/nvme/lmcache"}'

---

**vLLM start**

VLLM_GRAPH_REUS=1 \
VLLM_ATTENTION_BACKEND=FLASH_ATTN \
LMCACHE_SERVER_TIMEOUT=600 \
LMCACHE_CHUNK_SIZE=256 \
LMCACHE_REMOTE_URL="lm://192.168.100.154:8000" \
LMCACHE_REMOTE_SERDE="naive" \
LMCACHE_BLOCKING_TIMEOUT_SECS=30 \
FLASHINFER_DISABLE_VERSION_CHECK=1 \
CUDA_VISIBLE_DEVICES=0 \
VLLM_USE_V1=0 \
LMCACHE_CLIENT_MAX_MEM_USAGE=30GB \
LMCACHE_MEM_POOL_SIZE=20GB \
LMCACHE_BLOCKING_TIMEOUT_SECS=60 \
LMCACHE_LOOKUP_TIMEOUT_MS=60000 \
LMCACHE_USE_GDS=False \
LMCACHE_PIN_CHECK_INTERVAL_SEC=40 \
python3 -m vllm.entrypoints.openai.api_server \
  --model /home/deepbay/models/Qwen2.5-7B-Instruct/snapshots/master \
  --tensor-parallel-size 1 \
  --gpu-memory-utilization 0.85 \
  --host 0.0.0.0 \
  --port 8001 \
  --disable-hybrid-kv-cache-manager \
  --enforce-eager \
  --kv-transfer-config '{
      "kv_connector": "LMCacheConnectorV1",
      "kv_role": "kv_both"
  }'

and  stopped all firewall

---

**Describe the bug**
After vLLM starts and establishes a connection with LMCache, LMCache actively disconnects the connection after 30 seconds.

.154  the  LMCache server
sudo tcpdump -i any -nn -s0 -X port 8000

```
19:26:52.247316 ens64np1 In  IP 192.168.100.110.55180 > 192.168.100.154.8000: Flags [S], seq 3498215498, win 64240, options [mss 1460,sackOK,TS val 2558263562 ecr 0,nop,wscale 7], length 0
        0x0000:  4500 003c 8f8d 4000 4006 60d5 c0a8 646e  E..<..@.@.`...dn
        0x0010:  c0a8 649a d78c 1f40 d082 884a 0000 0000  ..d....@...J....
        0x0020:  a002 faf0 1995 0000 0204 05b4 0402 080a  ................
        0x0030:  987c 010a 0000 0000 0103 0307            .|..........
19:26:52.247335 ens64np1 Out IP 192.168.100.154.8000 > 192.168.100.110.55180: Flags [S.], seq 3356671337, ack 3498215499, win 65160, options [mss 1460,sackOK,TS val 105218450 ecr 2558263562,nop,wscale 10], length 0
        0x0000:  4500 003c 0000 4000 4006 f062 c0a8 649a  E..<..@.@..b..d.
        0x0010:  c0a8 646e 1f40 d78c c812 bd69 d082 884b  ..dn.@.....i...K
        0x0020:  a012 fe88 4a88 0000 0204 05b4 0402 080a  ....J...........
        0x0030:  0645 8192 987c 010a 0103 030a            .E...|......
19:26:52.247408 ens64np1 In  IP 192.168.100.110.55180 > 192.168.100.154.8000: Flags [.], ack 1, win 502, options [nop,nop,TS val 2558263563 ecr 105218450], length 0
        0x0000:  4500 0034 8f8e 4000 4006 60dc c0a8 646e  E..4..@.@.`...dn
        0x0010:  c0a8 649a d78c 1f40 d082 884b c812 bd6a  ..d....@...K...j
        0x0020:  8010 01f6 33f6 0000 0101 080a 987c 010b  ....3........|..
        0x0030:  0645 8192                                .E..
19:26:52.247659 ens64np1 Out IP 192.168.100.154.8000 > 192.168.100.110.55180: Flags [P.], seq 1:11, ack 1, win 64, options [nop,nop,TS val 105218450 ecr 2558263563], length 10
        0x0000:  4500 003e cbf0 4000 4006 2470 c0a8 649a  E..>..@.@.$p..d.
        0x0010:  c0a8 646e 1f40 d78c c812 bd6a d082 884b  ..dn.@.....j...K
        0x0020:  8018 0040 4a8a 0000 0101 080a 0645 8192  ...@J........E..
        0x0030:  987c 010b ff00 0000 0000 0000 017f       .|............
19:26:52.247701 ens64np1 In  IP 192.168.100.110.55180 > 192.168.100.154.8000: Flags [.], ack 11, win 502, options [nop,nop,TS val 2558263563 ecr 105218450], length 0
        0x0000:  4500 0034 8f8f 4000 4006 60db c0a8 646e  E..4..@.@.`...dn
        0x0010:  c0a8 649a d78c 1f40 d082 884b c812 bd74  ..d....@...K...t
        0x0020:  8010 01f6 33ec 0000 0101 080a 987c 010b  ....3........|..
        0x0030:  0645 8192                                .E..
19:27:22.277735 ens64np1 Out IP 192.168.100.154.8000 > 192.168.100.110.55180: Flags [F.], seq 11, ack 1, win 64, options [nop,nop,TS val 105248480 ecr 2558263563], length 0
        0x0000:  4500 0034 cbf1 4000 4006 2479 c0a8 649a  E..4..@.@.$y..d.
        0x0010:  c0a8 646e 1f40 d78c c812 bd74 d082 884b  ..dn.@.....t...K
        0x0020:  8011 0040 4a80 0000 0101 080a 0645 f6e0  ...@J........E..
        0x0030:  987c 010b                                .|..
19:27:22.318452 ens64np1 In  IP 192.168.100.110.55180 > 192.168.100.154.8000: Flags [.], ack 12, win 502, options [nop,nop,TS val 2558293633 ecr 105248480], length 0
        0x0000:  4500 0034 8f90 4000 4006 60da c0a8 646e  E..4..@.@.`...dn
        0x0010:  c0a8 649a d78c 1f40 d082 884b c812 bd75  ..d....@...K...u
        0x0020:  8010 01f6 4926 0000 0101 080a 987c 7681  ....I&.......|v.
        0x0030:  0645 f6e0                                .E..
```

19:26:52.247701 handshake  successed  after 30s 
19:27:22.277735  server req  Flags [F.] 

.110  the  vLLM client handshake  successed  after 30s received  Flags [F.] 

```
11:26:52.240805 ens68np0 Out IP 192.168.100.110.55180 > 192.168.100.154.8000: Flags [S], seq 3498215498, win 64240, options [mss 1460,sackOK,TS val 2558263562 ecr 0,nop,wscale 7], length 0
11:26:52.240888 ens68np0 In  IP 192.168.100.154.8000 > 192.168.100.110.55180: Flags [S.], seq 3356671337, ack 3498215499, win 65160, options [mss 1460,sackOK,TS val 105218450 ecr 2558263562,nop,wscale 10], length 0
11:26:52.240911 ens68np0 Out IP 192.168.100.110.55180 > 192.168.100.154.8000: Flags [.], ack 1, win 502, options [nop,nop,TS val 2558263563 ecr 105218450], length 0
11:26:52.241199 ens68np0 In  IP 192.168.100.154.8000 > 192.168.100.110.55180: Flags [P.], seq 1:11, ack 1, win 64, options [nop,nop,TS val 105218450 ecr 2558263563], length 10
11:26:52.241206 ens68np0 Out IP 192.168.100.110.55180 > 192.168.100.154.8000: Flags [.], ack 11, win 502, options [nop,nop,TS val 2558263563 ecr 105218450], length 0


11:27:22.270259 ens68np0 In  IP 192.168.100.154.8000 > 192.168.100.110.55180: Flags [F.], seq 11, ack 1, win 64, options [nop,nop,TS val 105248480 ecr 2558263563], length 0
11:27:22.310888 ens68np0 Out IP 192.168.100.110.55180 > 192.168.100.154.8000: Flags [.], ack 12, win 502, options [nop,nop,TS val 2558293633 ecr 105248480], length 0
```
---

The  result :

(EngineCore_DP0 pid=3268869) [2026-07-23 12:34:28,143] LMCache ERROR: Put task failed for key CacheEngineKey(model_name='/home/deepbay/models/Qwen2.5-7B-Instruct/snapshots/master', world_size=1, worker_id=0, chunk_hash=5887731399698834868, dtype=torch.bfloat16, request_configs=None, tags=None, _dtype_str='bfloat16'): [Errno 32] Broken pipe (remote_backend.py:220:lmcache.v1.storage_backend.remote_backend)

I have tried my best, but I still cannot find the cause of the problem. Please help me identify the

**Comment by maobaolong** [comment]
@Robot1024 It looks like you've started an LMCache server, this mean you start lmcache MP(MultiProcess) mode, but your VLLM is using the LMCacheConnectorV1 which mean you are using LMCache InProcess mode. These two are not compatible.

**Comment by Robot1024** [comment]
@maobaolong   thank you, i get it   
- LMCacheMPConnector  MP mode  vllm and lmcache must  deployment  on  the  same  GPU  node
- LMCacheConnectorV1  In-Process  mode  vllm deployment on GPU node , lmcahce deployment  remote  storage
- MP  lmcache start  use   lmcache_server  ,  In-Process  lmcache start use  lmcache server
